{
  "declaration_version": "1.0.0",
  "generated_by": "manualmente; cada entrada declara un módulo, su contrato y su evidencia",
  "core_suite_command": "python3 -m pytest tests -q",
  "modules": [
    {
      "module_id": "mdx",
      "title": "MDX",
      "phases": {
        "from": 61,
        "to": 70
      },
      "activation": "dormant_by_default",
      "default_enabled": false,
      "activation_option": "mdx.enabled",
      "enforcement": "schema",
      "profile_keys": [
        "mdx"
      ],
      "corpus_ref": "evals/cases/mdx.md",
      "justification": "El corpus piloto autorizado contiene componentes MDX dentro de .md (Info y CodeGroup), de modo que prepare.py necesita distinguirlos del HTML genérico en lugar de bloquear todo lo que parezca una etiqueta.",
      "corpus_real": true,
      "contract_paths": [
        "references/mdx-contract.md",
        "references/mdx-attributes.md",
        "references/mdx-review.md"
      ],
      "test_files": [
        "tests/test_mdx_assemble.py",
        "tests/test_mdx_attributes.py",
        "tests/test_mdx_contract.py",
        "tests/test_mdx_gate.py",
        "tests/test_mdx_parser.py",
        "tests/test_mdx_props.py",
        "tests/test_mdx_protect.py",
        "tests/test_mdx_review.py",
        "tests/test_mdx_selector.py",
        "tests/test_mdx_tabs.py"
      ],
      "test_prefixes": [
        "test_mdx_"
      ],
      "activation_negative_test": "tests/test_optional_activation.py::test_encender_sin_corpus_se_rechaza[mdx]",
      "deactivation_test": "tests/test_optional_deactivation.py::test_desactivacion_deja_el_flujo_del_nucleo_identico[mdx]",
      "failure_policy": {
        "entrypoint": "scripts/prepare.py",
        "exit_codes": [
          0,
          2
        ],
        "documented_in": "references/mdx-contract.md"
      },
      "limitations": [
        "No existe ningún archivo .mdx real en el repositorio: el corpus usa componentes MDX dentro de .md.",
        "La evidencia es de clasificación y contrato, no de traducción completa con el módulo activo.",
        "Los fixtures de tests/fixtures/mdx/ son sintéticos; el corpus que justifica la activación es el piloto."
      ],
      "known_external_gaps": [],
      "core_delegations": [
        {
          "from_script": "scripts/prepare.py",
          "imports": "mdx_selector",
          "kind": "detector",
          "why": "prepare.py necesita reconocer un componente MDX para bloquearlo cuando el módulo está apagado. Importa la librería pura del selector, no su CLI ni ningún estado del módulo."
        }
      ]
    },
    {
      "module_id": "html",
      "title": "HTML embebido",
      "phases": {
        "from": 71,
        "to": 80
      },
      "activation": "dormant_by_default",
      "default_enabled": false,
      "activation_option": "html.enabled",
      "enforcement": "schema",
      "profile_keys": [
        "html"
      ],
      "corpus_ref": "evals/cases/html.md",
      "justification": "El módulo existe y está probado sobre fixtures declarados; la medición de evals/cases/html.md §1 concluye que los corpus autorizados no contienen HTML del contrato, así que no se activa sobre ellos.",
      "corpus_real": false,
      "contract_paths": [
        "references/html-contract.md",
        "references/html-attributes.md",
        "references/html-compatibility.md"
      ],
      "test_files": [
        "tests/test_html_assemble.py",
        "tests/test_html_attributes.py",
        "tests/test_html_classify.py",
        "tests/test_html_contract.py",
        "tests/test_html_gate.py",
        "tests/test_html_malformed.py",
        "tests/test_html_matrix.py",
        "tests/test_html_parser.py",
        "tests/test_html_release_gate.py",
        "tests/test_html_selector.py",
        "tests/test_html_tables.py"
      ],
      "test_prefixes": [
        "test_html_"
      ],
      "activation_negative_test": "tests/test_optional_activation.py::test_encender_sin_corpus_se_rechaza[html]",
      "deactivation_test": "tests/test_optional_deactivation.py::test_desactivacion_deja_el_flujo_del_nucleo_identico[html]",
      "failure_policy": {
        "entrypoint": "scripts/prepare.py",
        "exit_codes": [
          0,
          2
        ],
        "documented_in": "references/html-contract.md"
      },
      "limitations": [
        "El corpus que lo activa es sintético: los corpus autorizados contienen 0 etiquetas del contrato.",
        "reports/pilot/profile.json y reports/beta/profile.json activaron html.enabled sin corpus que lo justificara; se declara como activación inmotivada y no se corrigen porque su hash está anclado en el manifiesto del piloto.",
        "Conservar HTML no demuestra que el importador de destino lo soporte."
      ],
      "known_external_gaps": [
        {
          "id": "html_destination_parity",
          "reason": "No hay evidencia de que un destino real conserve el HTML embebido como el contrato lo describe.",
          "owner": "usuario",
          "procedure": "Importar una muestra con el contrato y registrar el resultado con scripts/record_import_evidence.py.",
          "blocking_scope": "remote_verification_claim"
        }
      ],
      "core_delegations": [
        {
          "from_script": "scripts/prepare.py",
          "imports": "html_parser",
          "kind": "detector",
          "why": "prepare.py necesita reconocer HTML embebido y sus violaciones de contrato para bloquearlas cuando el módulo está apagado. Importa el parser puro, no su CLI."
        }
      ]
    },
    {
      "module_id": "markdown-extensions",
      "title": "Extensiones opcionales de Markdown",
      "phases": {
        "from": 81,
        "to": 90
      },
      "activation": "dormant_by_default",
      "default_enabled": false,
      "activation_option": "admonitions.enabled, definition_lists.enabled, directives.enabled, mermaid.labels, wikilinks.enabled, frontmatter_policy",
      "enforcement": "schema",
      "profile_keys": [
        "admonitions",
        "definition_lists",
        "directives",
        "mermaid",
        "wikilinks",
        "frontmatter_policy"
      ],
      "corpus_ref": "evals/cases/markdown-extensions.md",
      "justification": "Cada sub-módulo se activa contra su fixture declarado; la medición de evals/cases/markdown-extensions.md §1 concluye que ninguno aparece en los corpus autorizados, así que ninguno se activa sobre ellos.",
      "corpus_real": false,
      "contract_paths": [
        "references/markdown-contract.md",
        "references/footnotes.md",
        "references/admonitions.md",
        "references/definition-lists.md",
        "references/directives.md",
        "references/mermaid-labels.md",
        "references/math.md",
        "references/wikilinks.md",
        "references/frontmatter.md"
      ],
      "test_files": [
        "tests/test_admonitions.py",
        "tests/test_content_gates.py",
        "tests/test_definition_lists.py",
        "tests/test_dialect_matrix.py",
        "tests/test_directives.py",
        "tests/test_extension_combinations.py",
        "tests/test_footnotes.py",
        "tests/test_frontmatter_translate.py",
        "tests/test_math.py",
        "tests/test_mermaid_labels.py",
        "tests/test_wikilinks.py"
      ],
      "test_prefixes": [
        "test_admonitions",
        "test_content_gates",
        "test_definition_lists",
        "test_dialect_matrix",
        "test_directives",
        "test_extension_combinations",
        "test_footnotes",
        "test_frontmatter_translate",
        "test_math",
        "test_mermaid_labels",
        "test_wikilinks"
      ],
      "activation_negative_test": "tests/test_optional_activation.py::test_encender_sin_corpus_se_rechaza[admonitions]",
      "deactivation_test": "tests/test_optional_deactivation.py::test_desactivacion_deja_el_flujo_del_nucleo_identico[admonitions]",
      "failure_policy": {
        "entrypoint": "scripts/prepare.py",
        "exit_codes": [
          0,
          2
        ],
        "documented_in": "references/markdown-contract.md"
      },
      "limitations": [
        "Footnotes y matemáticas no tienen interruptor: el núcleo los trata siempre, y su contract dice que están siempre activos.",
        "Todos los fixtures del lote son sintéticos.",
        "El corpus piloto declara una admonition que en realidad es un atributo de Pandoc dentro de un fence: la medición de evals/cases/markdown-extensions.md §1 lo corrige."
      ],
      "known_external_gaps": [],
      "core_delegations": [
        {
          "from_script": "scripts/prepare.py",
          "imports": "admonitions",
          "kind": "detector",
          "why": "prepare.py necesita la lista de tipos de admonition admitidos para distinguir una construcción conocida de una no soportada. Importa la constante del módulo, no su CLI."
        },
        {
          "from_script": "scripts/prepare.py",
          "imports": "directives",
          "kind": "detector",
          "why": "prepare.py necesita la lista de directivas conocidas para emitir unsupported_directive en lugar de descartar el hallazgo. Importa el extractor puro."
        },
        {
          "from_script": "scripts/prepare.py",
          "imports": "mermaid_adapter",
          "kind": "detector",
          "why": "prepare.py necesita el detector de Mermaid malformado para poder bloquearlo cuando se traduce etiquetas. Importa el detector puro."
        }
      ]
    },
    {
      "module_id": "terminology",
      "title": "Terminología por dominio",
      "phases": {
        "from": 91,
        "to": 100
      },
      "activation": "dormant_by_default",
      "default_enabled": false,
      "activation_option": "terminology.enabled",
      "enforcement": "schema",
      "profile_keys": [
        "terminology"
      ],
      "corpus_ref": "evals/cases/terminology.md",